Pos-Nr. Nr.),(Pos-,Menge -Über Scharniere -Vier um 90° gedrehte,Einheit Gehäuse verbundener Anströmrichtungen wählbar,Gesamtpreis in EUR
,,"-herausnehmbarer Rauchmelderkopf (Funktionsprüfung) -Mit Verschmutzungsgradanzeige und ""Nachführung"" der Empfindlichkeitsschwelle (lange Standzeit), für Anzeige auf GLT -Mit Luftstromwächter (Warngrenzwert Luftgeschwindigkeit < 2 m/s) -Wartung einmal jährlich -mit allgemeiner bauaufsichtlicher Zulassung des Deutschen Instituts für Bautechnik -Produkts- und fabrikatsunabhängige Anwendung","-herausnehmbarer Rauchmelderkopf (Funktionsprüfung) -Mit Verschmutzungsgradanzeige und ""Nachführung"" der Empfindlichkeitsschwelle (lange Standzeit), für Anzeige auf GLT -Mit Luftstromwächter (Warngrenzwert Luftgeschwindigkeit < 2 m/s) -Wartung einmal jährlich -mit allgemeiner bauaufsichtlicher Zulassung des Deutschen Instituts für Bautechnik -Produkts- und fabrikatsunabhängige Anwendung","-herausnehmbarer Rauchmelderkopf (Funktionsprüfung) -Mit Verschmutzungsgradanzeige und ""Nachführung"" der Empfindlichkeitsschwelle (lange Standzeit), für Anzeige auf GLT -Mit Luftstromwächter (Warngrenzwert Luftgeschwindigkeit < 2 m/s) -Wartung einmal jährlich -mit allgemeiner bauaufsichtlicher Zulassung des Deutschen Instituts für Bautechnik -Produkts- und fabrikatsunabhängige Anwendung"
,,"Zustandanzeige am Rauchmelder durch LEDs, mit Drucktaster Reset/Test","Zustandanzeige am Rauchmelder durch LEDs, mit Drucktaster Reset/Test","Zustandanzeige am Rauchmelder durch LEDs, mit Drucktaster Reset/Test"
,,"mit Montagekonsole für runde Rohre oder Konsole für gedämmte Kanäle, mit Gummidichtung für Rohrdurchführung, mit Luftrohr bis 600mm Länge, mit Anpassung des Luftrohres an Nennweite des","mit Montagekonsole für runde Rohre oder Konsole für gedämmte Kanäle, mit Gummidichtung für Rohrdurchführung, mit Luftrohr bis 600mm Länge, mit Anpassung des Luftrohres an Nennweite des","mit Montagekonsole für runde Rohre oder Konsole für gedämmte Kanäle, mit Gummidichtung für Rohrdurchführung, mit Luftrohr bis 600mm Länge, mit Anpassung des Luftrohres an Nennweite des"
,,Rohres bzw. Abmessungen des Kanals,Rohres bzw. Abmessungen des Kanals,Rohres bzw. Abmessungen des Kanals
,,"inklusive Verkabelung zwischen Rauchauslöseeinrichtung und zugehöriger Brandschutzklappe, Entfernung ca. bis 10 m.","inklusive Verkabelung zwischen Rauchauslöseeinrichtung und zugehöriger Brandschutzklappe, Entfernung ca. bis 10 m.","inklusive Verkabelung zwischen Rauchauslöseeinrichtung und zugehöriger Brandschutzklappe, Entfernung ca. bis 10 m."
