Pos-Nr. (Pos- Nr.),Menge Einheit Einheitspreis in,Gesamtpreis in
6.2,EUR Baustelleneinrichtung/ Mobilkräne/ Gerüste/ Montagehilfen,EUR
6.2.1,"Im Gebäude stehen keine Pausenräume oder Lagerräume zur Verfügung Im Gebäude stehen keine Pausenräume oder Lagerräume zur Verfügung Einrichten und Räumen der Baustelleneinrichtung Einrichten und Räumen der Baustelleneinrichtung Bereitstellen, Auf- und Abbauen von Material-, Werkstatt- und/oder entsprechend Erfordernis des Bieters, einschl. Krangestellung für die Auf- und Abbau der Baustelleneinrichtung Beistellung von Elt-Kabeln zum Anschluss der Baustelleneinrichtung an die Die Baustelle ist so einzurichten, das bauliche Anlagen ordnungsgemäß errichtet","Mannschaftscontainer Baustromverteilung, oder geändert Belästigungen"
6.2.2,"1,000 St Vorhalten der Baustelleneinrichtung Vorhalten der Baustelleneinrichtung Vorhalten der Material-, Werkstatt- und/oder Mannschaftscontainer entsprechend Bieters für die Dauer der Ausführung inkl. Reinigung nach Erfordernis, jedoch mind. 1 x wöchentlich",Erfordernis des
6.2.3,"Umsetzen der Baustelleneinrichtung Umsetzen der Baustelleneinrichtung Umsetzen der Material-, Werkstatt- und/oder Mannschaftscontainer komplett oder in Anforderung des Auftraggeberer / der Bauleitung einschl. Krangestellung",Teilen auf
6.2.4,"1,000 St Zulage Container übereinander stapeln Zulage für das Aufeinanderstapeln von Mannschafts-/ Materialcontainer mit entsprechenden Treppen als Zuweg zu den oberen Containern",
6.2.5,"1,000 St Krangestellung Für folgende Arbeiten mit erhöhten Hebelasten ist der Einsatz eines Mobilkranes erforderlich: - Montage Fortluftturm, Dach Außenlager - Montage Ventilatoren, Außenlager - Montage Großkomponenten, 4. Obergeschoss - Montage Fortlufttürme, Dach Mobilkran, max. Hebelast 200 kg",
6.2.6,"horizontaler Förderweg ca. 30 m, von Standort Fortluftturm zu Bereitstellungsfläche Höhe Dach ca. 5 m, über Geländeniveau Bereitstellungsfläche Mobilkran. Höhe Fortluftturm ca. 6,5 m, über Geländeniveau Bereitstellungsfläche Mobilkran. 1,000 St Mobilkran, max. Hebelast 250 kg Mobilkran, max. Hebelast 250 kg, auf Baustelle anliefern und bereitstellen inkl. Abtransport, Kalkulation je Einsatz, inkl. erforderliche Anschlagmittel. Die Förderwege sowie die örtliche,","Bereitstellungsfläche Mobilkran Mobilkran,"
,"Transport für folgende Anlagen: - Radialventilatoren 00RLT01 Prozessfortluftanlage Hochdruckboxen Transportgewicht je Modul maximal ca. 250 kg, durch Dachöffnung mit den Abmessungen 1 m x 1 in das Außenlager.",m
,"Horizontale und vertikale Förderwege von der Dachöffnung zur Bereitstellungsfläche horizontaler Förderweg ca. 5 m, von Dachöffnung zu Dachkante, horizontaler Förderweg ca. 7 m, von Dachöffnung zu Bereitstellungsfläche Mobilkran, Höhe Attika Außenlager ca. 5 m, über Geländeniveau Bereitstellungsfläche Mobilkran, Höhe Fußboden Außenlager ca. 1 m, über Geländeniveau Bereitstellungsfläche Mobilkran.",Mobilkran
