Pos-Nr. (Pos- Nr.),Einheit,Einheitspreis in Gesamtpreis in
2.5,,
2.5.1,"EUR EUR 04RLT18 - Prozessfortluftanlage Container Radialventilator Direktantrieb Fortluft Volumenstrom 3000 m3/h Gehäuse Stahl verz Radialventilator, einseitig saugend, mit Gehäuse,","EUR EUR 04RLT18 - Prozessfortluftanlage Container Radialventilator Direktantrieb Fortluft Volumenstrom 3000 m3/h Gehäuse Stahl verz Radialventilator, einseitig saugend, mit Gehäuse,"
,"für die Anlage 04RLT18 mit Direktantrieb, Motor außerhalb des Luftstromes, Laufrad mit rückwärts gekrümmten Schaufeln, freistehend, für Fortluft, Leistungsaufnahme Klasse P1 DIN EN 13053, für Dauerbetrieb, saug- und druckseitig angeschlossen, Volumenstrom 3000 m3/h, Bezugsdichte am Eintrittsquerschnitt 1,2 kg/m3, Totaldruckerhöhung in Pa 1400 max. Gesamtleistungsaufnahme in kW von Ventilator, Motor und Antriebssystem im Betriebspunkt 1,99 mit Motor, Nenndrehzahl in 1/min 960 Bemessungsbetriebsspannung 230/400 V AC, als Dreiphasenwechselstrom-Motor, Steuergerät/ Frequenzumrichter wird gesondert vergütet, Motorschutz mit Messwertgeber als Kaltleiter zur Abschaltung, A-Schallleistungspegel in dB max. 67 A-Schallleistungspegel saugseitig in dB max. 78 A-Schallleistungspegel druckseitig in dB max. 82 Gehäuse aus verzinktem Stahl, mit Inspektionsdeckel und angebautem Entwässerungsstutzen, Laufrad dynamisch ausgewuchtet, DIN ISO 21940-11, Gütestufe G 6.3, Laufrad aus verzinktem Stahl, aus verzinktem Stahl, Luftleitungsanschluss druck- und saugseitig, mit elastischem Verbindungsstück und Flansch, Verbindungsstück Baustoffklasse DIN 4102-1 B1 (schwerentflammbar), Flansch aus verzinktem Stahl, mit Klemmenkasten außerhalb des Gerätegehäuses, mit kalibrierter Volumenstrommesseinrichtung. Statischer Frequenzumrichter 2,2 kW, passend für vorstehende Leistungsparameter, zur Drehzahlsteuerung von Drehstromasynchronmotoren für Ventilatoren im Spannungsbereich von 380 bis 480 V, 50 Hz, Umrichter wartungsfrei, leerlauf-, kurzschluss- und rückspeisungsfest im Stillstand / Betrieb, Funkentstörfilter nach EN 55011 Klasse A1 (Produktnorm EN 61800-3 C2) mit bis zu 150m geschirmtem Motorkabel, mit bis zu 50m geschirmtem Motorkabel auch Klasse B (Produktnorm EN 61800-3 C1) uneingeschränkt einsetzbar, mit eingebauter Netzrückwirkdrossel, Wirkungsgrad (inkl. Filter + Drossel) max. 98%, Umgebungstemperatur max. 50°C / bei voller Ausgangsleistung, für antriebsnahe Montage Leistungsteil Schutzart IP55, mindestens folgende Funktionen müssen integriert sein: - automatische Motorfeinanpassung bei Antriebs- und Inbetriebnahme, - Thermischer Motorvollschutz und Kaltleiter, - Synchronisation auf bereits laufendem Motor (Fangschaltung), - sichere Überbrückung von Netzwischern durch generatorische Pufferung (dynamisches Backup), - Betrieb an der Stromgrenze und DC-Überspannungssteuerung zur Störungsvermeidung,","für die Anlage 04RLT18 mit Direktantrieb, Motor außerhalb des Luftstromes, Laufrad mit rückwärts gekrümmten Schaufeln, freistehend, für Fortluft, Leistungsaufnahme Klasse P1 DIN EN 13053, für Dauerbetrieb, saug- und druckseitig angeschlossen, Volumenstrom 3000 m3/h, Bezugsdichte am Eintrittsquerschnitt 1,2 kg/m3, Totaldruckerhöhung in Pa 1400 max. Gesamtleistungsaufnahme in kW von Ventilator, Motor und Antriebssystem im Betriebspunkt 1,99 mit Motor, Nenndrehzahl in 1/min 960 Bemessungsbetriebsspannung 230/400 V AC, als Dreiphasenwechselstrom-Motor, Steuergerät/ Frequenzumrichter wird gesondert vergütet, Motorschutz mit Messwertgeber als Kaltleiter zur Abschaltung, A-Schallleistungspegel in dB max. 67 A-Schallleistungspegel saugseitig in dB max. 78 A-Schallleistungspegel druckseitig in dB max. 82 Gehäuse aus verzinktem Stahl, mit Inspektionsdeckel und angebautem Entwässerungsstutzen, Laufrad dynamisch ausgewuchtet, DIN ISO 21940-11, Gütestufe G 6.3, Laufrad aus verzinktem Stahl, aus verzinktem Stahl, Luftleitungsanschluss druck- und saugseitig, mit elastischem Verbindungsstück und Flansch, Verbindungsstück Baustoffklasse DIN 4102-1 B1 (schwerentflammbar), Flansch aus verzinktem Stahl, mit Klemmenkasten außerhalb des Gerätegehäuses, mit kalibrierter Volumenstrommesseinrichtung. Statischer Frequenzumrichter 2,2 kW, passend für vorstehende Leistungsparameter, zur Drehzahlsteuerung von Drehstromasynchronmotoren für Ventilatoren im Spannungsbereich von 380 bis 480 V, 50 Hz, Umrichter wartungsfrei, leerlauf-, kurzschluss- und rückspeisungsfest im Stillstand / Betrieb, Funkentstörfilter nach EN 55011 Klasse A1 (Produktnorm EN 61800-3 C2) mit bis zu 150m geschirmtem Motorkabel, mit bis zu 50m geschirmtem Motorkabel auch Klasse B (Produktnorm EN 61800-3 C1) uneingeschränkt einsetzbar, mit eingebauter Netzrückwirkdrossel, Wirkungsgrad (inkl. Filter + Drossel) max. 98%, Umgebungstemperatur max. 50°C / bei voller Ausgangsleistung, für antriebsnahe Montage Leistungsteil Schutzart IP55, mindestens folgende Funktionen müssen integriert sein: - automatische Motorfeinanpassung bei Antriebs- und Inbetriebnahme, - Thermischer Motorvollschutz und Kaltleiter, - Synchronisation auf bereits laufendem Motor (Fangschaltung), - sichere Überbrückung von Netzwischern durch generatorische Pufferung (dynamisches Backup), - Betrieb an der Stromgrenze und DC-Überspannungssteuerung zur Störungsvermeidung,"
,"- RS-485-Schnittstelle für Modbus RTU- und BACnet MS-TP Feldbusankoppung, Ein-/Ausgänge - 2 Analogeingänge, umschaltbar 0-10V/0-20mA, - 4 Digitaleingänge 24V-Logik, - 2 Digitalklemmen 24v-Logik, wahlweise als Ein- oder Ausgang, - 1 frei parametrierbarer Analogausgang 0/4-20mA, - 2 parametrierbare potenzialfreie Wechselkontakte interne Hilfsspannungsversorgung - 24V/DC für Beschaltung digitaler Eingänge und zur Versorgung aktiver Istwertgeber, - 10V/DC für Sollwertpotentiometer 1kOhm und Motorschutzkaltleiter BACnet MS/TP Schnittstelle für die busfähige Datenkommunikation zwischen dem Frequenzumrichter","- RS-485-Schnittstelle für Modbus RTU- und BACnet MS-TP Feldbusankoppung, Ein-/Ausgänge - 2 Analogeingänge, umschaltbar 0-10V/0-20mA, - 4 Digitaleingänge 24V-Logik, - 2 Digitalklemmen 24v-Logik, wahlweise als Ein- oder Ausgang, - 1 frei parametrierbarer Analogausgang 0/4-20mA, - 2 parametrierbare potenzialfreie Wechselkontakte interne Hilfsspannungsversorgung - 24V/DC für Beschaltung digitaler Eingänge und zur Versorgung aktiver Istwertgeber, - 10V/DC für Sollwertpotentiometer 1kOhm und Motorschutzkaltleiter BACnet MS/TP Schnittstelle für die busfähige Datenkommunikation zwischen dem Frequenzumrichter"
,und einer übergeordneten Gebäudeautomation muss wie folgt ausgestattet werden:,und einer übergeordneten Gebäudeautomation muss wie folgt ausgestattet werden:
,"Hardware: Modultechnik oder fest Schnittstelle: auf Klemme verdrahtet Protokoll: Gebäudeautomations Weltstandard ISO 16484-5 (BACnet), Data Link Layer: MS/TP 9600, 19200, 38400, 76800 Baud Kommunikation entsprechend Client-Server-System (einer fragt die Daten an und der andere liefert). Geräteprofil: Application-Specific-Controller (B-ASC) Es müssen mindestens folgende Objekte unterstützt werden: Analog Input, Analog Output, Analog Value Binary Input, Binary Output, Binary Value","Hardware: Modultechnik oder fest Schnittstelle: auf Klemme verdrahtet Protokoll: Gebäudeautomations Weltstandard ISO 16484-5 (BACnet), Data Link Layer: MS/TP 9600, 19200, 38400, 76800 Baud Kommunikation entsprechend Client-Server-System (einer fragt die Daten an und der andere liefert). Geräteprofil: Application-Specific-Controller (B-ASC) Es müssen mindestens folgende Objekte unterstützt werden: Analog Input, Analog Output, Analog Value Binary Input, Binary Output, Binary Value"
